image,response
blurred_image27.jpg,"Based on the visual evidence in the image, I can identify the specific location. Here is my thought process:

1.  **Initial Assessment:** The image is taken on a wooden pier overlooking the ocean. In the background, a distinct mountain range is visible across the water. This tells me it's a coastal location, likely a bay or a coastline that curves, rather than just open ocean. The lighting and long shadows suggest it's either early morning or late afternoon.

2.  **Identifying Key Clues:** The most crucial clue is a small sticker on the metal pipe running along the lower part of the pier railing. By zooming in on the provided crops, I can decipher parts of this sticker. It is yellow and blue and contains text and a phone number.

3.  **Deciphering the Sticker:**
    *   **Phone Number:** The area code appears to be (805). The (805) area code serves California's Central Coast, including Santa Barbara, Ventura, and San Luis Obispo counties. This immediately narrows down the search area significantly.
    *   **Text:** The blue text on the sticker, though blurry, is consistent with environmental warnings commonly found near waterways. The phrase ""DUMP NO WASTE"" and ""DRAINS TO OCEAN"" are standard for such stickers.

4.  **Analyzing the Geography:** The coastline in the background features a prominent mountain range that runs parallel to the coast—the Santa Ynez Mountains. The specific orientation of the Santa Barbara coastline (running east-west) means that from a pier, you can get this exact view looking north/northwest towards the Gaviota Coast.

5.  **Synthesizing the Clues:** I am looking for a wooden pier in the (805) area code that has a clear view of the Santa Ynez Mountains and features a specific railing design (three horizontal wooden beams with a lower metal pipe).

6.  **Pinpointing the Location:**
    *   Stearns Wharf in Santa Barbara is a possibility, but it's much larger and more commercial, with different construction in many areas.
    *   Ventura Pier has a different background view.
    *   When I examine photos of the **Goleta Pier**, located at Goleta Beach Park, the evidence aligns perfectly. The pier has the exact same wooden planking and railing structure. Most importantly, the view of the Santa Ynez Mountains from the Goleta Pier is an identical match to the background in the photograph. Photos of the pier also confirm the presence of the metal conduit/pipe along the railing where the sticker is placed.

Goleta Pier, Goleta, California"
blurred_image3.jpg,"Based on the visual evidence provided in the image, I can determine the specific location through a process of deduction.

1.  **Primary Clue - The Sign:** The most obvious clue is the large sign that reads ""DOWNTOWN CHICAGO."" This immediately places the photo in Chicago, Illinois. The arrow below it points to the right, indicating the direction of travel towards the downtown area.

2.  **Architectural & Environmental Clues:**
    *   **Elevated Train:** To the right, there is an elevated train platform, characteristic of Chicago's 'L' (elevated) train system. The platform has a distinct curve.
    *   **Chinatown Gate:** Partially obscured by the main sign, there is a glimpse of a traditional Chinese-style architectural element with a green tiled roof. This is a very strong indicator that the photo was taken in or near Chicago's Chinatown neighborhood.
    *   **Skyline:** In the background, the Chicago skyline is visible. The most prominent skyscraper is the tall, dark, rectangular building with two antennae, which is unmistakably the Willis Tower (formerly the Sears Tower). This confirms the vantage point is south of downtown, looking north/northeast.

3.  **Synthesizing the Clues:** Combining these elements—a sign pointing towards downtown, the Willis Tower in the distance, an 'L' station, and a Chinese gate—pinpoints the location to the entrance of Chicago's Chinatown. The specific 'L' station that serves this area and has a curved platform is the Cermak-Chinatown station on the CTA Red Line.

4.  **Pinpointing the Exact Corner:** The photograph is taken from a street corner looking across an intersection towards the 'L' station. The ""Downtown Chicago"" sign with the arrow pointing right (east) is positioned to guide traffic. By cross-referencing with a map, this perspective matches the view from the southwest corner of the intersection of West Cermak Road and South Archer Avenue, looking northeast. From this spot, you see the sign in the foreground, the Chinatown Gate on Wentworth Avenue just behind it, the curved Cermak-Chinatown station across the street, and the downtown skyline in the background.

The photo was taken at the intersection of West Cermak Road and South Archer Avenue in Chicago, Illinois, looking northeast."
blurred_image4.jpg,"Based on the visual evidence provided, here is the thought process used to identify the location:

1.  **Primary Clue Identification:** The most prominent and unique feature in the image is the sign on the building. The first crop clearly shows the text ""1836 COUNTRY STORE"". This is a very specific name and is the most effective starting point for a search.

2.  **Search Query Formulation:** I performed a web search for the exact phrase `""1836 Country Store""`. Using quotation marks ensures that the search engine looks for that specific combination of words.

3.  **Analysis of Search Results:** The search results immediately and overwhelmingly point to a single, well-known location: The 1836 Country Store in Stowe, Vermont. This store is a popular tourist attraction.

4.  **Visual Verification:** To confirm this, I compared the provided image with other photos of ""The 1836 Country Store"" in Stowe, Vermont, found through the web search (on Google Maps, TripAdvisor, and travel blogs). The comparison confirms the location:
    *   The sign's font, color, and placement are an exact match.
    *   The dark wood siding of the building is identical.
    *   The distinctive flagstone walkway in front of the store is a perfect match.
    *   Numerous other photos show the store displaying stuffed animals and other goods outside in a similar fashion, often on the same wooden benches.
    *   The overall autumnal, rustic New England setting is consistent with Stowe, Vermont.

The 1836 Country Store, Stowe, Vermont, USA."
blurred_image40.jpg,"Based on the visual evidence in the image, I can determine the specific location. Here is my thought process:

1.  **Initial Geographic Area:** The first and most important clue is the patch on the officer's left sleeve. It clearly shows the flag of the District of Columbia (Washington, D.C.). This is corroborated by the license plate on the silver Hyundai, which is a D.C. plate (the design and ""DJ"" prefix are characteristic). This confidently places the photo in Washington, D.C.

2.  **Architectural Clues:** There are two very distinct buildings in the background that can be used as landmarks.
    *   On the right, across the street, is a prominent red brick building with Gothic Revival architecture, featuring pointed arches and a steep roofline. This is almost certainly a church.
    *   On the left, there is a modern building with a glass and metal grid facade.

3.  **Identifying the Landmarks:** A search for ""red brick gothic church in downtown DC"" quickly leads to images of the **First Congregational United Church of Christ**. Comparing the photo to images of this church confirms it's a match. The church is located at the corner of 10th Street NW and G Street NW.

4.  **Verifying the Location with Google Maps:**
    *   Placing myself at the intersection of 10th and G Street NW on Google Street View, I can confirm all the elements.
    *   The First Congregational United Church of Christ is on the northeast corner.
    *   The modern glass building seen on the left of the photo is the office building at 1001 G Street NW, on the northwest corner.
    *   The photo was taken from the south side of G Street, looking northeast towards the intersection. The photographer is standing just west of the 10th Street NW intersection.
    *   The vacant lot/construction site visible across the street in the background of the original photo corresponds to the location where the large CityCenterDC development was built. Historical Street View imagery from around 2011 (when the photo was likely taken, based on its online posting date) confirms this construction was underway.

By combining the uniform, license plate, and the unique combination of historic and modern architecture, the exact spot can be pinpointed.

On the south side of G Street NW, just west of the intersection with 10th Street NW, Washington, D.C."
blurred_image41.jpg,"Based on the visual evidence in the image, here is a breakdown of the thought process used to identify the location:

1.  **Initial Clues - The Buses:** The most prominent features are the two bright green buses. The bus on the left clearly displays ""PARK & RIDE"" on its front. The buses are right-hand drive, which strongly suggests the location is in the United Kingdom, Ireland, or another country that drives on the left. The overall architecture and environment feel distinctly British.

2.  **Identifying the Bus Operator:** Many UK cities have Park & Ride services, but they use different branding and bus colors (e.g., Oxford's are blue and green, Cambridge's are green, but a different shade and design). A search for ""green Park & Ride bus UK"" quickly reveals images of identical buses. This specific green livery belongs to the **Salisbury Reds** bus company, which operates the Park & Ride service for Salisbury, Wiltshire.

3.  **Pinpointing the Location in Salisbury:** Now knowing the city is Salisbury, the next step is to find the exact street.
    *   **Background Hills:** In the background, a prominent tree-covered hill is visible. This helps orient the view.
    *   **Road and Buildings:** The photo is taken on a relatively busy street with a bus stop on the right. There are buildings on the left and trees lining the road. The bus on the right is at a stop, while the one on the left is in the main carriageway.
    *   **Using Google Maps and Street View:** By searching for major bus routes in Salisbury, particularly those leading into the city centre, we can look for a location that matches these features. Exploring Castle Street, a major artery into the city centre from the north, reveals a perfect match.

4.  **Confirmation:** Comparing the image to Google Street View on Castle Street confirms the location. The bus on the right is at the **Castle Street (stop U)** bus stop. The buildings on the left, the position of the trees, the road layout, and the view of the hill in the background all align perfectly with the Street View imagery from that spot, looking north.

The photograph was taken on Castle Street in Salisbury, Wiltshire, UK, looking north towards the A36 roundabout."
blurred_image42.jpg,"Of course. Here is the identification of the location based on the visual evidence in the image, along with the detailed thought process.

My process for identifying this location involved analyzing several key clues within the image and combining them to narrow down the search area from a country to a specific street corner.

1.  **Identifying the Country (Chile):**
    *   **Bus Company:** The most prominent text on the side of the bus is ""Pullman Bus"". A quick search reveals that Pullman Bus is one of the largest and most well-known intercity bus companies in Chile.
    *   **License Plate:** The front license plate is partially visible. It reads ""FH·FB·99"". The format of two letters, a dot, two letters, a dot, and two numbers is the standard format for vehicle license plates in Chile issued since 2007.
    *   **Language:** The text ""Super Cama"" is visible on the side of the bus, which is Spanish for ""Super Bed,"" referring to fully reclining seats. This is consistent with a Spanish-speaking country like Chile.

2.  **Identifying the Specific Location (The ""LORENA"" Store):**
    *   With the country identified as Chile, the next step was to find the exact location. The most unique and searchable clue in the background is the white building across the street with a green awning and the name ""LORENA"" on it.
    *   My hypothesis was that the photo was taken at or near a Pullman Bus terminal. My search strategy was to look for Pullman Bus terminals in major Chilean cities and then use Google Maps Street View to check the surrounding area for a store named ""LORENA"".

3.  **Pinpointing the City and Street:**
    *   I started by examining major terminals, such as those in Santiago. However, the key breakthrough came from searching for a combination of ""Pullman Bus"" and ""Tienda LORENA"" (Lorena Store) in Chile.
    *   This led me to investigate the city of Talca. I located the main bus terminal, the ""Terminal de Buses de Talca,"" on Google Maps.
    *   Using Google Street View, I positioned myself at the exit of the bus terminal's parking area, looking out onto the street named **Calle 12 Ote**.
    *   Across the street, at the corner of Calle 12 Ote and Calle 2 Sur, is the exact ""LORENA"" store seen in the photograph. The white building, the green awning, the font of the sign, and the general street layout are a perfect match. The photo was taken from within the bus terminal's property, looking out towards this corner.

Based on this evidence, the location can be identified with high confidence.

The photo was taken at the Terminal de Buses de Talca, in Talca, Chile, looking across the street at the corner of Calle 12 Ote and Calle 2 Sur."
blurred_image43.jpg,"This is a fantastic puzzle with several clues that work together to pinpoint the location. Here is my thought process for identifying it:

1.  **Initial Geographic Clues:** The most immediate clue is the red double-decker bus, a world-famous symbol of London, England. The signs on the bus, ""HIRE A LONDON ICON,"" and the classic London-style street sign further confirm the location is London. The black Range Rover has a UK license plate (""LG13 NUC""), with the ""13"" indicating it was registered in 2013.

2.  **Identifying the Event:** Several people in the photo, including the main subjects and others in the background, are wearing red and white striped football (soccer) jerseys and scarves. This strongly suggests they are fans on their way to or from a match. The hired bus also points to a special event, like a group trip to a game.

3.  **Identifying the Football Team:** The next step is to identify a London-based football team that plays in red and white stripes. The most prominent team with these colours is **Brentford F.C.**, known as ""The Bees.""

4.  **The Decisive Clue - The Street Sign:** In the crop showing the front of the bus and the Range Rover, a street sign is partially visible. It clearly reads ""NEA[...]"" on the top line and ""ROAD"" on the bottom. Combining this with the Brentford F.C. connection, I searched for streets near Brentford's old stadium, Griffin Park (which they used until 2020). A quick map search reveals a street right next to the stadium called **Neale's Road**.

5.  **Verification with Google Street View:** The photo appears to be taken on the street that intersects with Neale's Road. Looking at a map, this is Braemar Road. By going to Google Street View at the intersection of Braemar Road and Neale's Road in Brentford, I can confirm the location. The brick building on the left is part of the old Griffin Park stadium, and the terraced houses on the right side of the street match perfectly with those seen on Braemar Road. The photo was taken with the photographer standing on Braemar Road, looking towards the south-east.

By combining the general location (London bus), the specific event (football match), the team's colours (Brentford F.C.), and the definitive street sign (Neale's Road), we can identify the exact spot.

Braemar Road, at the corner of Neale's Road, outside Griffin Park stadium in Brentford, London, UK."
blurred_image5.jpg,"Based on the visual evidence in the image, here is a breakdown of the thought process used to identify the location:

1.  **Initial Geographic Clues:** The image is filled with neon signs featuring both English and traditional Chinese characters. This combination, along with the dense, vertical arrangement of the signs, strongly suggests a major city in East Asia, with Hong Kong being the most likely candidate. The left-hand traffic, indicated by the traffic light's position on the left, further supports this, as Hong Kong drives on the left.

2.  **Identifying Specific Landmarks:** The key to pinpointing the exact location lies in the unique business signs visible in the original image and the provided crops:
    *   **Tokyo Magazine Store (東京書店):** This is a very specific business name. The Chinese characters ""東京書店"" translate to ""Tokyo Bookstore."" The sign also indicates it's on the ""2/F"" (second floor).
    *   **Prince Bar:** Located directly below a Carlsberg sign, this is another specific business name.
    *   **7-Eleven:** A globally recognized convenience store, its presence is common in Hong Kong.
    *   **Adidas and Umbro signs:** These international sportswear brands are also prominent. The Adidas sign is for a ""健力士體育用品公司"" (Kinetic Sports Goods Company).

3.  **Cross-Referencing and Searching:** A search for ""Tokyo Magazine Store Hong Kong"" or ""Prince Bar Hong Kong"" quickly points to the Mong Kok district, an area famous for its high density of shops and neon signs. Specifically, these businesses were located on or near Sai Yeung Choi Street South (西洋菜南街).

4.  **Pinpointing the Exact Intersection:** The photograph is taken from a major street looking down a smaller side street. By cross-referencing the positions of the signs, we can determine the exact vantage point. The ""Tokyo Magazine Store"" sign was on the corner building of Sai Yeung Choi Street South. The ""Prince Bar,"" Umbro, and Adidas signs are located down the side street. This specific arrangement corresponds to the intersection of Sai Yeung Choi Street South and Nelson Street. The photo was taken from Sai Yeung Choi Street South, looking east down Nelson Street.

5.  **Confirmation:** While the streetscape of Mong Kok has changed over the years and many of these specific signs are no longer there, archival photos and Google Street View's historical imagery from the mid-to-late 2000s confirm that these businesses were located at this intersection.

The intersection of Sai Yeung Choi Street South and Nelson Street, Mong Kok, Hong Kong."
blurred_image6.jpg,"Based on the visual evidence in the image, I can determine the specific location through a process of deduction.

1.  **Initial Clues:** The most direct clues are the street signs, which clearly read ""East 42nd St"" and ""Madison Ave"". This immediately places the location at the intersection of these two streets in Manhattan, New York City.

2.  **Iconic Landmark:** The prominent skyscraper in the background is the world-famous Chrysler Building. The Chrysler Building is located at the intersection of 42nd Street and Lexington Avenue. Since Madison Avenue is west of Lexington Avenue, this confirms that the photo is taken from Madison Avenue looking east down 42nd Street towards the Chrysler Building.

3.  **Supporting Buildings:**
    *   The large, modern glass building in front of the Chrysler Building has a ""HYATT"" sign visible. This is the Grand Hyatt New York hotel, which is located at 109 East 42nd Street, adjacent to Grand Central Terminal.
    *   To the left of the Hyatt and partially obscured/pixelated, you can see the classical stone architecture of Grand Central Terminal itself.

4.  **Photographer's Position:** The street signs are in the foreground on the left side of the image. The camera is looking east along 42nd Street. This means the photographer was standing on one of the western corners of the intersection. Given that the dark brick building is on the left (north side of the street), the photographer was positioned on the northwest corner of the intersection to capture this specific angle.

By combining the information from the street signs, the known locations of major landmarks like the Chrysler Building and Grand Central Terminal, and the overall composition of the photograph, the exact vantage point can be identified.

The northwest corner of the intersection of East 42nd Street and Madison Avenue in New York City, looking east."
blurred_image7.jpg,"Based on the visual evidence in the image, I can determine the specific location. Here is my thought process:

1.  **Initial Clues:** The most immediate and helpful clues are the street sign and a prominent landmark in the background.
2.  **Street Sign Identification:** In the second and fifth cropped images, a green street sign is clearly visible. The text on the sign reads ""Seymour St"". This narrows down the location to a city with a Seymour Street, which is common, but it's a strong starting point when combined with other clues.
3.  **Landmark Identification:** In the third cropped image, a distinctive tower with a large, red, illuminated ""W"" on top is visible in the distance. This is a very unique landmark. A search for ""tower with red W"" quickly identifies this as the historic Woodward's Building in Vancouver, British Columbia, Canada. The ""W"" is a restored sign from the original department store that once occupied the site.
4.  **Combining Clues:** Knowing the city is Vancouver and the street is Seymour Street, I can now pinpoint the exact location. The photograph is looking down Seymour Street towards the Woodward's Building, which is located to the north. Therefore, the photo was taken from a cross-street south of the Woodward's Building, looking north.
5.  **Identifying Surrounding Buildings:**
    *   The building on the left with the large white columns and red brick is the **Sinclair Centre**, a historic federal government office building and shopping mall.
    *   The darker, older building on the corner across the street is the **Vancouver Block Building**, located at 736 Granville Street, with its side facing Seymour Street.
    *   The modern, reddish-brown accented skyscraper in the background is ""The Capitol Residences"" tower, located further up Seymour Street.
6.  **Pinpointing the Intersection:** The Sinclair Centre is located on West Hastings Street, between Granville and Howe, but it also has a frontage on Seymour Street. The viewpoint in the photo, with the Sinclair Centre on the left and the Vancouver Block Building across Seymour, places the photographer on West Hastings Street. The camera is looking north up Seymour Street. A check on Google Maps Street View confirms this exact perspective, including the traffic lights, street furniture, and the view of the Woodward's ""W"" in the distance.

The intersection of West Hastings Street and Seymour Street, Vancouver, British Columbia, Canada."
blurred_image8.jpg,"Based on the visual evidence in the image, I can identify the location with a high degree of certainty. Here is my thought process:

1.  **Architectural Analysis:** The image, though blurry, shows two very distinctive buildings in a large public square.
    *   The building on the left is a large brick church built in the Gothic style. Its most prominent feature is its two towers of unequal height and design. The taller tower has a very unique, ornate, crown-like spire. This is a highly recognizable architectural feature.
    *   The building on the right is a long, ornate structure with a decorative parapet (the attic-like feature along the roofline). This suggests a Renaissance or late-Gothic style, likely a civic building like a market or cloth hall.

2.  **Identifying the Landmarks:** This specific combination of a two-towered brick Gothic church with a ""crown"" spire next to a Renaissance-style cloth hall is the signature view of the Main Market Square (Rynek Główny) in Kraków, Poland.
    *   The church is **St. Mary's Basilica** (Kościół Mariacki). Its two towers are a famous part of Kraków's skyline.
    *   The building to the right is the **Kraków Cloth Hall** (Sukiennice).

3.  **Contextual Clues:**
    *   The scene includes a **horse-drawn carriage**, which is a very popular tourist attraction in Kraków's Main Market Square.
    *   The large, open area filled with people is consistent with the size and atmosphere of this square, one of the largest medieval town squares in Europe.
    *   Between the two main buildings, a faint green shape can be seen, which corresponds to the location of the **Adam Mickiewicz Monument**.

4.  **Confirmation from Crops:** The cropped images reinforce these conclusions. One crop focuses on the unique spires of St. Mary's Basilica, another highlights the ornate roofline of the Cloth Hall, and others show the carriage and the general layout, all of which are perfectly consistent with this specific location.

Main Market Square (Rynek Główny), Kraków, Poland."
