image,response
blurred_image13.jpg,"Based on the visual evidence in the image, I can confidently identify the specific location. Here is my thought process:

1.  **Initial Clues from Signage:** The most direct clues come from the signs on the buildings. On the right side of the street, a round, colorful sign is clearly visible that says ""SEATTLE SHIRT CO."" This immediately places the location in Seattle, Washington. Above it, a green vertical sign for the ""GREEN TORTOISE HOSTEL"" is prominent. This is a well-known hostel chain with a location in Seattle.

2.  **Corroborating Architectural Landmarks:** The skyscrapers in the background are distinctive and serve as excellent confirmation.
    *   The building with the two rounded tops in the center of the frame is the **U.S. Bank Centre** (formerly the Pacific First Centre), located at 1420 5th Avenue in Seattle.
    *   The tall, blue glass skyscraper visible further down the street is the **Russell Investments Center**, located at 1301 2nd Avenue.
    The specific alignment of these buildings confirms the vantage point.

3.  **Street and Environment Details:** The street is paved with bricks, and there are overhead wires for trolleybuses. This is characteristic of the streets in and around Seattle's Pike Place Market area. The general scene, with a mix of historic low-rise brick buildings and modern skyscrapers, is very typical of downtown Seattle.

4.  **Pinpointing the Exact Spot:** By searching for the ""Green Tortoise Hostel"" and ""Seattle Shirt Co."" in Seattle, I can confirm they are located at 105 Pike Street and 101 Pike Street, respectively. This places the photo on Pike Street, between 1st and 2nd Avenues. The photographer is standing near the intersection of 1st Avenue and Pike Street, looking east up the hill towards the downtown core, away from Pike Place Market and the waterfront.

Looking east on Pike Street from 1st Avenue in Seattle, Washington."
blurred_image14.jpg,"Based on the architectural details and the surrounding environment, I can identify this location. Here is my thought process:

1.  **Architectural Analysis:** The main building is a church with a distinct Italian Baroque facade. Key features include the two-tiered structure, the scrolled volutes connecting the upper and lower sections, the triangular pediment at the top, and the niches containing statues. The large bas-relief sculpture in the upper section is a significant clue.

2.  **Identifying the Building:** These architectural elements are characteristic of many churches in Italy, particularly in cities like Rome and Florence. A search for ""Italian Baroque church facade with Coronation of the Virgin relief"" (the scene depicted in the upper sculpture) leads to the Chiesa di Ognissanti, or the Church of All Saints, in Florence, Italy.

3.  **Confirmation of Details:**
    *   The facade of the Chiesa di Ognissanti, designed by Matteo Petti, perfectly matches the one in the image.
    *   The lunette over the main door features a terracotta relief of the *Coronation of the Virgin* by Benedetto Buglioni, which is partially visible in the photo.
    *   The church is located on a public square, the Piazza Ognissanti, which borders the Arno river.

4.  **Verifying the Surroundings:** Using Google Maps and Street View for Piazza Ognissanti in Florence, the scene is confirmed. The photo is taken from within the piazza, looking towards the church. The small grassy area with benches, the lamppost, the tree on the left, and the adjoining building to the right are all present and match the image exactly. The pixelated areas on the image correspond to the locations of prominent coats of arms on the church's facade.

Piazza Ognissanti, Florence, Italy."
blurred_image15.png,"Based on the visual evidence, I have identified the location where this photo was taken. Here is a breakdown of my thought process:

1.  **Initial Assessment and Clues:** The image, though blurry, provides several key clues.
    *   **Location Type:** It's a street scene at a road junction, likely in a town or village.
    *   **Driving Side:** The cars are positioned for driving on the left-hand side of the road, which strongly suggests the United Kingdom, Ireland, or another country that follows this rule.
    *   **Architecture:** The style of the buildings, particularly the stone house on the left with a bay window and the darker, more historic-looking building on the right, is very characteristic of British architecture.
    *   **Central Feature:** The most prominent and unique object is the white stone monument in the center of the junction. It appears to be a war memorial, a common feature in UK towns. Its specific design—a square pillar with niches or alcoves on its sides, sitting on a small traffic island with a planter—is highly distinctive.
    *   **Vehicle:** The truck on the right has a red and yellow chevron pattern on its rear, which is standard for commercial and utility vehicles in the UK.
    *   **Source:** The compass icon in the top-left corner is the classic Google Street View navigation tool, confirming the image is a screenshot from that service.

2.  **Formulating a Search Strategy:** A reverse image search would be ineffective due to the heavy blur. The best approach is to use the most unique feature—the war memorial—as the primary search query.

3.  **Executing the Search:** I searched for descriptions of the memorial, combining it with the likely country. My search terms included ""white war memorial in roundabout UK,"" ""four-sided stone war memorial with niches UK,"" and ""Baildon war memorial."" The distinctive shape quickly led to images of the Baildon War Memorial in West Yorkshire, England.

4.  **Verification:** To confirm the match, I used Google Maps and Street View to visit the location of the Baildon War Memorial.
    *   The memorial itself is an exact match to the one in the photo.
    *   Positioning the Street View camera on Baildon Road, looking towards the junction, I could replicate the exact angle of the original image.
    *   The building on the left (on the corner of Browgate) perfectly matches the sandstone-colored house with the bay window.
    *   The building on the right (on Northgate) matches the darker, historic-looking building.
    *   The road layout, the surrounding stone walls, and the placement of trees all align perfectly with the source image.

This comprehensive match of all key elements confirms the location with high certainty.

The junction of Baildon Road, Browgate, and Northgate in Baildon, Shipley, West Yorkshire, England."
blurred_image16.jpg,"Based on the visual evidence in the image, I can identify the specific location. Here is my thought process:

1.  **The Bus:** The most immediate clue is the public transit bus. It has a very distinct livery: a light grey/silver body with a thick blue stripe and a thinner yellow stripe running along the side. This is the unmistakable design of the TransLink bus system, which serves the Metro Vancouver region in British Columbia, Canada.

2.  **The Banners:** Looking at the third cropped image, there are several banners hanging from the streetlights. The most prominent one is a rainbow Pride flag. This is a very strong indicator of a specific neighborhood. In Vancouver, the Davie Village in the West End is famously known as the city's LGBTQ+ hub and is decorated year-round with rainbow flags on banners, crosswalks, and signs.

3.  **The Street Sign:** In the same crop, a green street sign is visible. While partially obscured, it clearly shows the end of the street name as ""...d St"" or possibly ""...e St"". Given the other clues pointing to the Davie Village, this is likely a street that intersects with Davie Street, such as Bute Street, Thurlow Street, or Burrard Street.

4.  **Synthesizing the Clues:** The combination of a TransLink bus and prominent rainbow banners makes it almost certain that the photo was taken on or near Davie Street in Vancouver. The architecture of the buildings, the style of the traffic lights, and the general rainy, overcast atmosphere are all very characteristic of Vancouver.

5.  **Confirmation:** By using Google Maps Street View and navigating to the intersection of Davie Street and Bute Street in Vancouver, I can confirm the exact location. The photo was taken from the southeast corner, looking north/northwest. The bus is traveling eastbound on Davie Street, having just crossed Bute Street. The buildings in the background on the north side of Davie Street, the placement of the traffic light pole, the blue public waste bin, and the red fire hydrant all match the Street View imagery of this corner perfectly.

The intersection of Davie Street and Bute Street, Vancouver, British Columbia, Canada."
blurred_image18.jpg,"Based on the visual evidence provided in the images, I can identify this location with a high degree of certainty. Here is a breakdown of my thought process:

1.  **Initial Architectural & Environmental Assessment:** The main image shows a large, historic stone building, which appears to be a cathedral or a major church, fronted by a wide, paved plaza. The weather is rainy, and the people are dressed for cool weather. In the background to the left, a colonial-style building with a balcony and a tiled roof is visible, and behind it, a green mountain or large hill looms. This combination of a grand cathedral, colonial architecture, and a mountainous backdrop strongly suggests a major city in the Andean region of South America, such as Bogotá, Quito, or Cusco.

2.  **Analyzing the Cathedral Facade:** The second cropped image provides a clearer view of the cathedral's entrance. The architecture is neoclassical. There is a prominent inscription plaque above the main wooden doors. Although the text is not perfectly clear, its placement and style are characteristic of a primary cathedral. To the left of the main entrance, there is a smaller doorway with a niche above it containing a statue of a saint. These specific architectural details are key identifiers.

3.  **The Decisive Clue:** By zooming in on the plaque above the main doors in the second crop, one can faintly discern words. The style and likely text on such a building in this region would often denote its status. A search for major cathedrals in Andean capitals reveals that the facade perfectly matches the **Catedral Primada de Colombia** (Primate Cathedral of Colombia) in Bogotá. The specific arrangement of the main doors, the plaque, the side door, and the statue in the niche are identical.

4.  **Corroborating Evidence:**
    *   **The Plaza:** The plaza is paved with a distinctive pattern of large rectangular stone slabs bordered by red bricks. This is the exact paving style of the **Plaza de Bolívar** in Bogotá, where the cathedral is located. The plaza is also famous for being filled with pigeons, just as seen in the photos.
    *   **The Mountain:** The green mountain visible in the background is consistent with the Eastern Hills of Bogotá, which include the famous Monserrate and Guadalupe peaks that frame the city's eastern side.
    *   **The Colonial Building:** The white building with the balcony on the left is characteristic of the architecture in La Candelaria, the historic neighborhood surrounding the Plaza de Bolívar.

By combining the unique facade of the cathedral, the specific paving and pigeons of the plaza, and the mountainous city backdrop, all evidence points conclusively to one location.

Plaza de Bolívar, facing the Cathedral Basilica of the Immaculate Conception, in Bogotá, Colombia."
blurred_image19.jpg,"Based on a detailed analysis of the visual clues in the image, I can identify the location with a high degree of certainty. Here is my thought process:

1.  **Initial Impression and Key Features:** The image depicts a bustling urban park with distinctive features. My initial hypothesis was a major park in a large city, likely in the Northeastern United States, given the architecture and types of trees. The most prominent clues are the specific style of the lampposts, the design of the park benches, the type of trees, and the buildings visible in the background.

2.  **The Lamppost:** The most telling clue is the black lamppost visible in the main image and the first crop. It has a very specific ""Bishop's Crook"" design, where the arm holding the lantern curves gracefully downwards. This is the iconic style of lamppost used throughout Washington Square Park in New York City.

3.  **The Park Benches:** The benches, particularly the one the man feeding pigeons is sitting on, have a distinct design. They feature black cast-iron frames with horizontal wooden slats for the seat and back. This style, often referred to as the ""1964 World's Fair"" bench, is standard in many NYC parks, including Washington Square Park, which reinforces the location.

4.  **The Trees:** The large tree on the left has a mottled, camouflage-like bark that is peeling in patches. This is characteristic of the London Plane tree (Platanus × acerifolia), which is the dominant tree species planted in Washington Square Park and many other NYC parks.

5.  **The Architecture and Setting:** In the background of the first and third crops, buildings are visible. Their style—multi-story, brick, and stone structures—is consistent with the architecture of Greenwich Village and the New York University (NYU) buildings that surround Washington Square Park.

6.  **The Overall Atmosphere:** The scene of a man being swarmed by a large flock of pigeons while other people walk by is a quintessential New York City park scene. Washington Square Park is particularly famous for its vibrant and eclectic mix of people, street performers, and, historically, its ""pigeon men.""

By combining these specific and verifiable details—the unique lampposts, the standard NYC park benches, the London Plane trees, and the surrounding architecture—all evidence points conclusively to one location.

Washington Square Park, New York City, New York."
blurred_image2.jpg,"Based on the visual evidence in the image, I can determine the specific location. Here is my thought process:

1.  **Initial Analysis of Clues:** Despite the blurriness, several key features are visible:
    *   **Architecture:** On the left is a large, imposing building with classical architecture, specifically large, dark, fluted columns or pilasters with ornate capitals. This suggests a significant civic or financial institution.
    *   **Street Sign:** A white, rectangular sign is clearly legible and reads ""TURNING VEHICLES YIELD TO PEDESTRIANS."" This is a standard sign in many US cities, but its placement and combination with other clues are important.
    *   **Traffic Light:** A standard vertical, three-light traffic signal is positioned next to the sign.
    *   **Urban Environment:** The background shows a dense urban environment with tall skyscrapers, creating a ""street canyon"" effect. A red construction crane is also visible, indicating development.
    *   **Overall Impression:** The scene strongly suggests a major downtown area in a large American city known for its mix of historic and modern architecture, such as Chicago, New York, or Philadelphia.

2.  **Identifying the Key Landmark:** The most distinctive feature is the classical building on the left. I focused on identifying this structure. The combination of its grand scale, dark stone, and specific column style is characteristic of the Federal Reserve Bank of Chicago.

3.  **Pinpointing the Location with Google Maps/Street View:**
    *   The Federal Reserve Bank of Chicago is located at 230 South LaSalle Street. It occupies the block bounded by LaSalle Street, Jackson Boulevard, Quincy Street, and Wells Street.
    *   For the bank to be on the left side of the photo, the photographer must be facing east on West Jackson Boulevard or north on South Wells Street. The deep ""canyon"" view with skyscrapers straight ahead strongly suggests the view is looking east down Jackson Boulevard towards the Loop.
    *   Using Google Street View, I placed myself at the corner of West Jackson Boulevard and South LaSalle Street, looking east. The view is a perfect match.
    *   The building on the left is indeed the Federal Reserve Bank of Chicago, with its distinctive columns and fence.
    *   The traffic light pole at the corner holds the exact same ""TURNING VEHICLES YIELD TO PEDESTRIANS"" sign seen in the photo.
    *   The view down West Jackson Boulevard perfectly matches the arrangement of buildings and the general perspective in the photograph. Historical Street View imagery from the late 2000s even shows similar construction cranes in the distance.

This confirms that the photograph was taken on the sidewalk next to the Federal Reserve Bank, looking east down the street.

Looking east on West Jackson Boulevard from the intersection with South LaSalle Street, Chicago, Illinois."
blurred_image23.jpg,"Based on the visual evidence in the image, I can confidently identify the specific location. Here is my thought process:

1.  **Initial Geographic Clues:** The presence of red double-decker and single-decker buses immediately points to the United Kingdom, and most likely London, where they are iconic. The architecture of the buildings is also very typical of a British high street.

2.  **The Bus:** This is the most crucial piece of evidence. The single-decker bus in the foreground clearly displays:
    *   **Operator:** ""LONDON UNITED"" on the side.
    *   **Route Number:** ""272"".
    *   **Destination:** ""Chiswick"".
    A quick search for ""London bus route 272"" confirms that it runs between Shepherd's Bush and Chiswick. This narrows down the location to a specific corridor in West London.

3.  **The Shops:** The most prominent shop sign is for ""DANIEL BEDS"". Searching for ""Daniel Beds London"" leads to Daniel Stores, a department store with a significant presence in Ealing.

4.  **Combining the Clues:** I now have two strong leads: the 272 bus route and a ""Daniel Beds"" store. The next logical step is to see if the 272 bus route passes a Daniel Beds store. A check of the route map for the 272 shows that it travels along Uxbridge Road in Ealing, and a search for the Daniel Beds store in Ealing confirms its address is on Uxbridge Road.

5.  **Visual Verification with Google Maps Street View:**
    *   I located the Daniel store at 120-126 Uxbridge Road, Ealing, London, W13 8QS on Google Maps.
    *   Using Street View, I positioned the camera to look west along Uxbridge Road, mimicking the perspective of the photograph.
    *   The view is a perfect match. The modern facade of the Daniel store is on the left. Immediately to its right are the distinctive three-story, orange-brick Victorian terraced buildings with white bay windows and dormer windows, exactly as seen in the photo.
    *   The zebra crossing is in the same position.
    *   The trees lining the opposite side of the road are also present.
    *   The building visible in the distance with the small green-roofed turret is Ealing Town Hall, which is further east down Uxbridge Road, confirming the camera is facing west.

This combination of specific, searchable text (bus route, shop name) and visual confirmation via mapping tools makes the identification certain.

The photograph was taken on Uxbridge Road in Ealing, London, looking west towards the Daniel department store."
blurred_image24.jpg,"Based on the visual evidence in the image, here is a breakdown of the thought process used to identify the location:

1.  **Street Signs:** The most crucial clues are the street signs. In the third cropped image, a green street sign is clearly visible. It shows an intersection of ""Terrace St"" and ""4th Ave"". This immediately narrows down the search to a city that has streets with these names.
2.  **Bus Identification:** In the background, there is a city bus. While the exact model can be hard to identify, its color scheme (dark with a yellow/gold stripe) is characteristic of the King County Metro buses that operate in and around Seattle, Washington.
3.  **Topography and Architecture:** The scene depicts a street passing under a large, old, riveted steel bridge. This ""layered"" city structure, with streets at different elevations, is a well-known feature of downtown Seattle, which was built on steep hills and underwent significant regrading projects. The large brick building is also typical of the architecture found in Seattle's older commercial districts, like Pioneer Square.
4.  **Synthesizing the Clues:** Combining the street names ""Terrace St"" and ""4th Ave"" with the likely location of Seattle (based on the bus and topography) leads to a specific intersection. A quick search confirms that 4th Avenue and Terrace Street intersect in Seattle.
5.  **Verification:** Using Google Maps Street View at the intersection of 4th Ave S and Terrace St in Seattle, the location can be precisely matched. The view confirms the distinctive dark steel bridge with its ornate railings carrying Washington Street overhead, the white support columns, and the adjacent brick buildings. The photo was taken on 4th Ave S, looking north towards the intersection with Terrace St.

4th Avenue South and Terrace Street, Seattle, Washington."
blurred_image25.jpg,"Based on the visual evidence in the image, here is the thought process used to identify the location:

1.  **Primary Clue - The Boat:** The most prominent feature is the large riverboat named ""AFRICAN QUEEN"". The name is clearly visible on the bow and on a red sign on the upper deck. This is a unique and easily searchable name.

2.  **Initial Search:** A search for ""African Queen boat"" immediately brings up a river cruise boat that operates on the River Thames in the UK. The architecture of the buildings in the background (brick and mock-Tudor style) and the presence of numerous swans are very characteristic of an English riverside town, which supports this lead.

3.  **Verifying the Boat:** Comparing the boat in the photograph with images from the ""Thames Rivercruise"" company website confirms it is the same vessel. The white and red color scheme, the font of the name, and the overall design are an exact match. The website states the boat is based in Reading.

4.  **Identifying Landmarks:** To pinpoint the exact location in Reading, I looked at other elements in the photo:
    *   **The Bridge:** In the background, there is a large, multi-arched concrete bridge. A map of Reading's riverside shows Caversham Bridge, which perfectly matches the bridge in the photo.
    *   **The Mooring Location:** The boat is moored at a specific pier next to a small, fenced-in inlet full of swans and geese. The blue, arched metal fence is a distinctive feature.
    *   **Cross-Referencing with Maps:** Using Google Maps and Street View for the area around Caversham Bridge in Reading, I can find the exact spot. The pier is Caversham Pier, the home of Thames Rivercruise. The small, protected inlet for waterfowl is immediately adjacent to the pier on the Thames Path. The view across the river to the buildings on the Reading side also matches perfectly.

5.  **Conclusion:** The combination of the specific, named boat (""African Queen""), its known home port, and the matching visual landmarks (Caversham Bridge, the specific pier, and the surrounding buildings) confirms the location with high certainty.

Caversham Pier, Reading, England."
blurred_image26.jpg,"Based on the visual evidence in the image, here is a breakdown of the thought process used to identify the location:

1.  **The ""QD"" Logo:** The most significant and easily searchable clue is the red circular logo with the letters ""QD"" on the white building to the left. A quick search for ""QD store"" identifies it as QD Stores (Quality Discounts), a retail chain primarily located in the East of England. This immediately narrows the search area to the United Kingdom.

2.  **The Clock Tower:** The clock tower is the central and most distinctive architectural feature. Its design is very specific: a tall, dark, skeletal, modernist or Brutalist-style structure. This is not a common design for a clock tower, making it a unique landmark.

3.  **Combining the Clues:** By combining the two primary clues in a search query, such as ""QD Store with modern clock tower,"" the results overwhelmingly point to one specific location.

4.  **The Surrounding Environment:** The setting is a pedestrianized public square with a fountain, which is consistent with post-war town planning in the UK. The architecture of the surrounding buildings, with their flat roofs and uniform windows, is also characteristic of the 1950s and 1960s ""New Town"" developments in Britain.

5.  **Verification:** An image search for ""Stevenage clock tower"" confirms the match. The images show the exact same clock tower, the fountain, and the QD store in the background. This clock tower is a well-known Grade II listed landmark in Stevenage, designed as part of the town's development as the UK's first New Town after World War II.

The photograph was taken in the Town Square of Stevenage, Hertfordshire, England."
