image,response
blurred_image9.jpg,"Based on the visual evidence, here is a breakdown of how the location was identified:

1.  **Architectural Analysis:** The most prominent feature is the large, ornate building. Its style is characteristic of late 19th-century American architecture, specifically Richardsonian Romanesque or Queen Anne style. Key features include the use of brownstone and brick, a prominent rounded corner turret with multiple bay windows, and a complex roofline with red tiles. This style is very common in cities in the Northeastern United States, particularly Boston.

2.  **Initial Hypothesis:** The architecture strongly suggests Boston's Back Bay or South End neighborhoods, which are famous for their preserved rows of brownstone mansions.

3.  **Identifying the Building:** A search for ""Boston brownstone corner turret mansion"" or similar terms quickly leads to images of the **Burrage Mansion**. Comparing the photo with known images of the Burrage Mansion confirms a perfect match, from the window arrangement on the turret to the color and texture of the stone and the shape of the roof. The mansion is located at 314 Commonwealth Avenue.

4.  **Determining the Vantage Point:** The photo is not taken from street level. The perspective is elevated, looking slightly down and across a road. The presence of a large, pixelated green sign is a major clue. In the US, large green signs are typically used for highway and major roadway directions. This suggests the photo was taken from a bridge or overpass that crosses near the building.

5.  **Using Google Maps/Street View for Confirmation:**
    *   By locating the Burrage Mansion at the corner of Commonwealth Avenue and Massachusetts Avenue in Boston on Google Maps, we can see that Massachusetts Avenue crosses over Commonwealth Avenue on a bridge.
    *   Using Google Street View and placing the camera on the northbound side of the Massachusetts Avenue bridge, looking southeast, reveals the exact scene from the photograph.
    *   From this vantage point, you can see the Burrage Mansion in the same orientation, the specific model of streetlight seen in the photo, the concrete railing of the bridge in the foreground, and the large green highway sign directing traffic to Storrow Drive and I-90 (The Mass Pike), which perfectly matches the pixelated sign in the image.

View from the Massachusetts Avenue bridge, looking southeast at the Burrage Mansion on the corner of Commonwealth Avenue in Boston, Massachusetts."
blurred_kyungbook.webp,"Based on the visual evidence in the image, I can confidently identify the location. Here is a breakdown of my thought process:

1.  **Architectural Style:** The architecture is distinctly East Asian, characterized by the tiered, tiled roofs, wooden support structures, and the specific color palette. The use of green, red, and dark grey/black tiles, a style known as *dancheong*, is a very strong indicator of traditional Korean palace or temple architecture.

2.  **Layout and Scale:** The image shows a very large, important-looking building situated in the center of a massive, stone-paved courtyard. The building sits atop a two-tiered stone terrace (*woldae* in Korean) with ornate balustrades. This layout is typical for a main throne hall or audience hall within a royal palace complex, where the king would conduct state affairs. The small stone markers in the courtyard are rank stones (*pumgyeseok*), which designated where court officials would stand according to their rank.

3.  **Geographic Features:** A prominent, lush green mountain looms in the background. The presence of a major mountain directly behind a grand palace is a key feature of Seoul's geography. This specific mountain is Bugaksan (also called Baegak), which sits directly north of Seoul's main palace.

4.  **Specific Buildings:**
    *   The main building in the foreground is Geunjeongjeon Hall, the Throne Hall of Gyeongbokgung Palace. Its two-story structure and position on the elevated stone terrace are unmistakable.
    *   In the background, nestled between the palace and the mountain, a building with a distinctive blue-tiled roof is visible. This is the iconic Cheong Wa Dae, also known as the Blue House, which was the executive office and official residence of the President of South Korea until 2022. Its location directly behind Gyeongbokgung is a definitive clue.
    *   The large pixelated area on the mountain is also a significant clue. This is often done in publicly available images and maps (like Google Maps/Earth) to obscure sensitive locations. Given that the Blue House is a major government facility, the pixelation is likely hiding security installations or other related buildings on the mountain behind it.

By combining the unique Korean architecture of Geunjeongjeon Hall, the presence of the rank stones in the courtyard, the specific backdrop of Bugaksan Mountain, and the unmistakable sight of the Blue House, the location can be pinpointed with certainty.

Geunjeongjeon Hall, Gyeongbokgung Palace, Seoul, South Korea."
blurred_UTK.webp,"Based on the visual evidence, even though the image is heavily blurred, I can identify the location by analyzing its distinct architectural features.

Here is my thought process:

1.  **Initial Observation:** The image shows a large, symmetrical building made of red or orange-toned brick with a prominent central clock tower. The roof appears to be made of red tiles. The architectural style is Collegiate Gothic, which is very common for university buildings constructed in the early 20th century in the United States.
2.  **Architectural Details:**
    *   **Clock Tower:** The tower is the most identifiable feature. It has a clock face near the top, set within a lighter-colored stone section. Below the clock, there are two tall, narrow, arched openings.
    *   **Materials:** The combination of orange-hued brick with light-colored stone or limestone trim is a key characteristic.
    *   **Symmetry:** The building extends symmetrically on both sides of the central tower.
    *   **Roof:** The vibrant red-orange roof is another strong visual clue.
3.  **Formulating a Hypothesis:** These features are characteristic of a landmark building on a major university campus. The specific combination of the orange-toned brick, the red roof, and the particular design of the clock tower are the primary clues for a search.
4.  **Search and Verification:** I performed a search for ""university with orange brick clock tower and red roof."" This led me to several candidates, but one stood out immediately. By comparing the blurred image to clear photos online, I was able to match the specific details:
    *   The clock tower design of **Ayres Hall** at the **University of Tennessee, Knoxville** is a perfect match, including the clock, the two arched windows directly beneath it, and the crenelated top.
    *   The University of Tennessee's primary color is orange, which is reflected in the brickwork of this iconic building.
    *   The red tile roof and the limestone trim seen in clear photos of Ayres Hall correspond exactly to the colors and shapes visible in the blurred image.
    *   The overall massing and symmetry of the building in the photo align perfectly with Ayres Hall, which is situated prominently on a hill known as ""The Hill.""

Ayres Hall, University of Tennessee, Knoxville."
