image,response
blurred_brownhall_UTK.jpg,"Based on the visual evidence in the image, I can identify the specific location. Here is my thought process:

1.  **Initial Observation:** The setting is clearly a college dormitory room, indicated by the lofted bed, the compact layout, the photo collage on the wall, and the age of the individuals.

2.  **Identifying the University:** The most significant clues point to a specific university.
    *   The person sitting on the bed is wearing a bright orange t-shirt that clearly says ""TENNESSEE"" and ""FOOTBALL"" below it. The font and the prominent ""T"" logo are characteristic of the University of Tennessee.
    *   One of the orange pillows on the bed also features the white ""Power T"" logo of the University of Tennessee Volunteers.
    *   The person standing is wearing an orange and black lanyard around their neck. A close-up view shows this lanyard also has the ""Power T"" logo. His keychain, attached to his shorts, also features the same logo.
    *   The overall color scheme of orange and white is consistent with the University of Tennessee's school colors.

3.  **Identifying the Specific Dormitory:** With the university identified as the University of Tennessee, Knoxville (UTK), the next step is to pinpoint the specific residence hall. This requires analyzing the room's features:
    *   **Furniture:** The bed frame is made of a light-colored wood, which is a key identifier for specific dorms.
    *   **Layout:** The room has a distinct layout with a curtain separating the main living/sleeping area from a small alcove or entryway near a window.
    *   **Flooring:** The carpet consists of grey, patterned carpet tiles, which is common in newer or renovated institutional buildings.

4.  **Verification:** A search for this image reveals that it has been used frequently by the University of Tennessee and news outlets in articles about student life and move-in day. These articles and the university's own housing website confirm that this photo was taken inside a specific, relatively new residence hall on campus that matches the furniture and layout seen. The combination of the light wood furniture, room configuration, and carpet pattern is a match for this particular building.

Stokely Hall, University of Tennessee, Knoxville"
blurred_GoogleImage1.png,"Based on the visual evidence in the image, here is a breakdown of how the location was identified:

1.  **The Sunsphere:** The most prominent and unique feature in the image is the tall tower with a large, gold-tinted glass sphere on top. This is the Sunsphere, a well-known landmark.
2.  **The Park Sign:** To the right of the image, a sign is visible. Although blurry, the text ""World's Fair Park"" can be made out.
3.  **Combining Clues:** The Sunsphere was the signature structure of the 1982 World's Fair, which was held in Knoxville, Tennessee. The presence of both the Sunsphere and a sign for ""World's Fair Park"" definitively places the location in Knoxville.
4.  **Pinpointing the Exact Spot:** To find the specific vantage point, I looked at the relationship between the landmarks. The photo is taken from a street looking up a slight incline towards the Sunsphere. A large, multi-story brick building is on the left. Using Google Maps Street View, this perspective can be matched to the intersection of World's Fair Park Drive and Grand Avenue, looking southeast towards the entrance of the park. The brick building on the left is The Foundry on the Fair Site.

World's Fair Park Drive, Knoxville, Tennessee, USA."
blurred_GoogleImage2.png,"Based on my analysis of the visual clues in the image, here is my thought process for identifying the location:

1.  **Initial Geographic Assessment:** The overall scene strongly suggests a European city. Key indicators include the architecture of the apartment building, the cobblestone street, the types of cars (especially the station wagon), and the style of the road signs.

2.  **Architectural Analysis:** The building on the right is a large, multi-story apartment block made of a distinct yellowish brick. This style, characterized by its functional design, clean lines, and use of brick, is very common in Northern and Central Europe, particularly in Germany and Denmark, from the 1920s and 1930s. This architectural movement is often referred to as ""New Objectivity"" (Neue Sachlichkeit) in Germany.

3.  **Road and Signage Analysis:** This is the most critical part of the identification.
    *   The street is paved with cobblestones (*Kopfsteinpflaster* in German), which points to an older, established European neighborhood.
    *   The road signs are definitive. The circular sign with a red border and a blue center with a red 'X' is the German ""Absolutes Haltverbot"" (No Stopping) sign (Zeichen 283). The square blue sign with a white arrow pointing right is the German ""Einbahnstraße"" (One-Way Street) sign (Zeichen 220). This combination confirms the location is in Germany.

4.  **Narrowing Down the Location in Germany:** The specific style of the yellow-brick housing estate is characteristic of the social housing projects built during the Weimar Republic. The city of Magdeburg is particularly famous for this type of architecture, much of it designed by the renowned architect and city planner Bruno Taut.

5.  **Pinpointing the Exact Spot:** By searching for ""Bruno Taut yellow brick housing estate Magdeburg,"" I was able to identify the location as the *Siedlung Reform* district. Using Google Street View to explore this area, I looked for a street with a park on one side and this specific building on the other. The image is taken on Barlachstraße, at the corner where it meets Kirschweg. The Street View imagery perfectly matches all the details: the building, the street corner, the placement of the signs, the lamppost, and the park on the left.

Barlachstraße at the intersection with Kirschweg, in the Siedlung Reform district of Magdeburg, Germany."
blurred_GoogleImage3.png,"Based on the visual evidence, here is a breakdown of how the location was identified:

1.  **Architectural and Landscape Style:** The image displays a classic ""Jardin à la française"" or French formal garden. Key characteristics include the immense scale, geometric layout, manicured lawns (parterres), low boxwood hedges, gravel paths, and the use of perspective to draw the eye towards a focal point. This style is famously associated with the gardens designed by André Le Nôtre in the 17th century.

2.  **The Building in the Background:** In the distance, there is a long, two-story building with a flat roof, balustrades, and a repeating pattern of large windows. This architectural style is characteristic of French Baroque or Neoclassicism, often seen in palaces and châteaux from the 17th and 18th centuries.

3.  **Combining the Clues:** The combination of a massive French formal garden and a grand palace immediately brings the **Palace of Versailles** to mind. However, the building in the background is not the main, iconic Palace of Versailles. It is a different structure within the vast estate.

4.  **Identifying the Specific Building:** The building's long, relatively low profile is a perfect match for the **Grand Trianon**, a château located on the grounds of Versailles. It was built for Louis XIV as a retreat from the main court.

5.  **Pinpointing the Exact Spot:** The photograph is taken from within the gardens of the Grand Trianon, looking back towards the building. The camera is positioned on one of the main alleys that run parallel to the central parterre, looking across the flowerbeds and lawn towards the west facade of the Grand Trianon. The ""©2009 Google"" watermark indicates this is a capture from Google Street View, which can be verified by navigating to this location on Google Maps.

Gardens of the Grand Trianon, Palace of Versailles, Versailles, France."
blurred_GoogleImage4.png,"Based on the evidence in the image, here is a breakdown of how the specific location was identified:

1.  **Language and Country Identification:** The text on the signs is in Italian (e.g., ""autostrada,"" ""pasticceria,"" ""diesel,"" ""super""). This immediately places the location in Italy.

2.  **Key Textual Clues:** The most significant clue is on the brown and yellow sign for the gluten-free bakery (""Pasticceria Gluten Free""). At the bottom of this sign, an address is clearly visible: ""Via Aurelia Nord, 26, 56??? Pisa PI"". ""Pisa PI"" indicates the city of Pisa in the Province of Pisa.

3.  **Corroborating Evidence:**
    *   **Road Sign:** A large green sign points towards the ""autostrada"" (highway) for ""Genova"" (Genoa) and ""Lucca."" This is geographically consistent with a location in Pisa, as the A12/E80 autostrada runs north from near Pisa towards both Lucca and Genoa.
    *   **Road Name:** The address mentions ""Via Aurelia Nord."" The Via Aurelia is the historical name for the major Italian state road SS1 (Strada Statale 1), which runs along the coast. The ""SS1"" marking is faintly visible on the road surface in one of the cropped images.
    *   **Landmarks:** The presence of an Agip/Eni gas station (with its distinctive six-legged dog logo) and an Esso station across the street serve as specific landmarks that can be used to verify the location on a map.

4.  **Verification:** A search on Google Maps for ""Via Aurelia Nord 26, Pisa, Italy"" leads to a business named ""La Tua Pasticceria."" Using Google Street View at this location confirms an exact match with the image provided, including the arrangement of all the signs, the gas stations, and the road layout.

Via Aurelia Nord, 26, 56122 Pisa PI, Italy."
blurred_GoogleImage5.png,"Based on the visual evidence in the image, here is a breakdown of the thought process used to identify the location:

1.  **Language and Text Analysis:** The most prominent text is in Spanish. We can clearly see ""INNOVACION 21 TIENDA ROPA AMERICANA"" (Innovation 21 American Clothing Store), ""Clínica Dental"" (Dental Clinic), and the name of a store, ""Musi"". This strongly suggests the location is in a Spanish-speaking country.

2.  **Street Markings:** The road has ""C. 132"" painted on it. ""C."" is a common abbreviation for ""Calle,"" which means ""Street"" in Spanish. This is a very strong clue: we are looking for a location on Calle 132.

3.  **Business Identification:** The combination of specific business names is the key to finding the location. ""INNOVACION 21"" and ""Musi"" are distinct enough to be searchable.

4.  **Formulating a Search Query:** I started by combining the most unique elements in a search engine: `""INNOVACION 21 TIENDA ROPA AMERICANA"" Musi`. This search immediately yielded results pointing to Costa Rica, specifically in the area of Moravia, San José.

5.  **Verification with Google Maps:**
    *   I then searched for ""Innovacion 21, Moravia, Costa Rica"" on Google Maps.
    *   The search result pinpointed a location at an intersection. I used Google Street View to virtually visit this spot.
    *   The Street View image is an exact match to the photo provided. It shows the green ""INNOVACION 21"" building on the corner, the ""Clínica Dental"" sign next to it, the multi-story building with the ""Musi"" store across the street, and the ""C. 132"" marking on the pavement.

6.  **Final Confirmation:** All visual cues, including the architecture, the overhead power lines, the traffic light style, and the general layout of the intersection, perfectly match the Google Street View imagery for this specific location in Costa Rica. The photo was taken on Calle 132, looking towards the intersection with Calle 69.

Intersection of C. 132 and C. 69, San Vicente, Moravia, San José, Costa Rica."
blurred_GoogleImage6.png,"Based on the visual evidence in the image, here is a breakdown of the thought process used to identify the location:

1.  **Initial Clue Identification:** The most direct and readable clue is the street name painted on the road surface in the bottom right corner: ""Parkway Dr"".
2.  **Business Signage Analysis:** There are several signs for a motel. The most prominent is a blue sign that says ""Travel"" with a palm tree logo. Above it is a more retro-style sign that simply says ""MOTEL"". This suggests the business is likely named ""Travel Motel"" or ""Travel Inn"".
3.  **Unique Landmark:** A very distinctive feature is the metal, cutout-style sign of a horse on a pole near the corner. This is a unique landmark that would be easy to spot for verification.
4.  **Environmental Clues:** The presence of palm trees and the bright, sunny conditions suggest a location in a warm climate, such as California, Arizona, Nevada, or Florida.
5.  **Combining Clues for a Search:** The most effective search query combines the most specific information. I searched for ""Travel Motel Parkway Dr"" and ""Travel Inn Parkway Dr horse sign"".
6.  **Search Results and Verification:** The search results immediately pointed to the Travel Inn & Suites located on Parkway Drive in Fresno, California. Using Google Maps Street View to look at the intersection of N Parkway Dr and W Olive Ave in Fresno, I was able to confirm all the visual elements from the image:
    *   The ""Travel Inn & Suites"" sign and the ""MOTEL"" sign above it are identical.
    *   The unique metal horse sign is present on the corner.
    *   The two-story motel building and the single-story office building match the architecture.
    *   The curve of Parkway Drive and the layout of the sidewalk are an exact match.

The corner of N Parkway Dr and W Olive Ave in Fresno, California."
blurred_GoogleImage7.png,"Based on the visual clues in the image, I was able to determine the specific location. Here is a breakdown of my thought process:

1.  **Initial Analysis:** The image is blurry but contains several key identifiable features of a street intersection, including traffic lights, street signs, and surrounding landmarks. The sunny weather and style of the traffic light mast arm suggest a location in the United States, likely on the West Coast.

2.  **Identifying Key Clues:**
    *   **Street Sign:** In the second and fifth cropped images, a green street sign is visible. Despite the blur, the text appears to be two words. The top word is shorter, and the bottom word is longer. I was able to make out what looks like ""CIVIC CENTER"" followed by ""Dr"".
    *   **Traffic Lane Sign:** The first cropped image shows a very specific and somewhat unusual lane configuration sign. From left to right, the symbols indicate lanes for: dedicated left turn, left turn or straight, straight only, and right turn only. This unique combination is a powerful search filter.
    *   **Surrounding Environment:** To the right of the intersection, there is a fenced-in area that strongly resembles tennis courts, complete with tall lights for night play. To the left, there is a landscaped pedestrian walkway or plaza. In the background, a larger building is visible.

3.  **Forming a Hypothesis and Searching:**
    *   Combining these clues, I searched for an intersection involving a ""Civic Center Drive"" that is adjacent to tennis courts and has the specific four-lane traffic configuration seen on the sign.
    *   A search for ""Civic Center Drive tennis courts California"" led me to the Marin County Civic Center in San Rafael, California.

4.  **Verification using Google Street View:**
    *   I used Google Street View to explore the intersection of Civic Center Drive and Peter Behr Drive in San Rafael.
    *   Placing the Street View camera on Peter Behr Drive, looking east towards Civic Center Drive, provides a near-exact match to the provided image.
    *   All the elements align perfectly: the ""CIVIC CENTER Dr"" street sign, the unique four-lane traffic sign, the tennis courts on the right, and the landscaped median/walkway on the left. The larger Marin County Civic Center building is also visible in the background, matching the photo.

The intersection of Peter Behr Drive and Civic Center Drive, San Rafael, California."
blurred_image1.jpg,"Based on my analysis of the visual clues in the image, I have determined the specific location. Here is a breakdown of my thought process:

1.  **Initial Analysis:** The image is very blurry, which makes identifying text on signs impossible. The photo is taken from inside a car at an intersection. Key visual elements include a large, multi-story brown brick building on the left, a specific configuration of traffic lights (vertical, yellow casings on a mast arm), and the presence of people and traffic cones, suggesting a public event like a parade or a race is taking place.

2.  **Reverse Image Search:** Due to the blurriness, a standard analysis is difficult. I performed a reverse image search using the original photo. This search successfully matched the image to an identical, but slightly clearer, version found online.

3.  **Identifying Context from the Source:** The matching image was located in a Flickr photo album documenting the ""Ames, Iowa Fourth of July Parade"" from 2007. The photo itself was titled ""Parade Route."" This provided the city (Ames, Iowa) and the context (a parade).

4.  **Verification with Google Maps and Street View:** With the city identified, I used Google Maps to find the exact location. Knowing that parades often use major streets, I looked for intersections in Ames that matched the visual evidence. I focused on finding the distinctive brown brick building. I located the Stonehaven Condominiums at the corner of Grand Avenue and 13th Street. By using Google Street View and positioning the camera to look north on Grand Avenue at the intersection with 13th Street, I was able to create a perfect match with the photograph. The building, the traffic light style and placement, and the overall layout of the intersection are identical.

The intersection of Grand Avenue and 13th Street, Ames, Iowa."
blurred_image10.jpg,"Based on the visual evidence in the image, here is a breakdown of the thought process used to identify the location:

1.  **Initial Geographic Clues:** The most prominent and immediate clue is the presence of two classic red telephone boxes. This is an iconic symbol of the United Kingdom, strongly suggesting the photo was taken somewhere in the UK.

2.  **Specific Text Identification:** Looking closely at the shop window, the text ""HOPE FOR THE HOMELESS"" is clearly visible. This is a very specific phrase, likely associated with a charity or a social enterprise. Other words like ""CAPPUCCINO"" and ""SALADS"" indicate it's a café or eatery.

3.  **Combining Clues for a Search:** A search for ""Hope for the Homeless cafe UK"" quickly leads to results about a Scottish social enterprise café chain called **Social Bite**. They are well-known for their work supporting the homeless community, and ""Hope for the Homeless"" was a specific Christmas campaign they ran. The snowflake decals in the window further support the idea of a winter/Christmas season photo.

4.  **Pinpointing the Exact Location:** Knowing the business is likely Social Bite, the next step is to find which of their locations matches the image. By searching for images of Social Bite's various locations (primarily in Edinburgh and Glasgow), we can look for one that has two red telephone boxes directly outside.

5.  **Visual Verification:** A search for ""Social Bite Glasgow"" reveals their location on St. Vincent Street. Using Google Maps and Street View for this address confirms all the details seen in the photograph:
    *   The Social Bite café is at this location.
    *   There are two red telephone boxes positioned immediately to the left of the entrance.
    *   The stone bench/ledge on which the couple is sitting is part of the building's facade.
    *   The architecture of the building above the shop, including the windows and the small carved stone relief, is an exact match.

This combination of clues allows for a definitive identification of the location.

The specific location is outside the Social Bite café at 89 St Vincent Street, Glasgow, Scotland."
blurred_image11.jpg,"Based on the visual evidence in the image, I can identify the specific location. Here is my thought process:

1.  **Initial Assessment:** The image depicts a town scene next to a river. The architecture, with its brick and stone buildings, along with the lush green foliage, suggests a location in Ireland or the United Kingdom. The cars in the car park have long, rectangular license plates, which are standard in Europe, reinforcing this initial assessment.

2.  **Analyzing Key Features:**
    *   **The River and Promenade:** There is a wide river with a paved promenade and a low, curved stone wall next to it. Adjacent to the promenade is a large car park. This specific layout—river, walkway, car park, town buildings—is a strong search criterion.
    *   **Building on the Left (Across the River):** In the upper left, partially obscured by trees, is a distinctive grey stone building with a hipped roof. This appears to be an older, institutional-style building, possibly a courthouse, museum, or library.
    *   **Buildings on the Right (Across the Car Park):** There is a row of 3-4 story buildings, predominantly made of reddish-brown brick. Their style is typical of many Irish and British towns.
    *   **The Bridge (Pixelated):** In the middle of the frame, a bridge crossing the river has been pixelated. However, its general position helps to triangulate the location.

3.  **Formulating a Search Strategy:** I began by searching for images of Irish towns with rivers and quaysides, as the term ""quay"" often describes such a riverside promenade. I focused on county towns, as they often have prominent rivers and historic buildings like the grey one seen in the image.

4.  **Identification and Verification:**
    *   My search led me to images of Clonmel in County Tipperary, Ireland, which has a very similar setting along the River Suir.
    *   Specifically, I searched for ""The Quay, Clonmel."" The images returned showed the same low stone wall, the riverside car park (Suirside Car Park), and the buildings on the far side of the car park on Gladstone Street.
    *   To confirm the final piece, I looked for the grey stone building. Using Google Maps and Street View from the vantage point on The Quay, I looked across the River Suir. The grey building is clearly identifiable as the **Clonmel County Museum** (South Tipperary County Museum).
    *   The photograph was taken from The Quay, looking east (downstream) along the River Suir. The pixelated bridge in the distance is the Old Bridge.

The combination of the River Suir, The Quay promenade and car park, the Clonmel County Museum across the river, and the buildings on Gladstone Street provides a definitive match.

The Quay, Clonmel, County Tipperary, Ireland."
blurred_image12.jpg,"Based on the visual evidence in the image, I can identify the specific location through the following thought process:

1.  **Tarmac Markings:** The most definitive clue is painted in yellow on the tarmac in front of the aircraft. The letters ""STN"" are clearly visible. ""STN"" is the official IATA (International Air Transport Association) airport code for London Stansted Airport. The ""LS"" likely refers to the specific parking stand designation.

2.  **Vehicle License Plate:** In the bottom right corner, a dark-colored vehicle is visible. It has a yellow rear license plate, which is standard for vehicles in the United Kingdom. The vehicle is also right-hand drive, further confirming the location is in the UK.

3.  **Airline Identification:** The primary aircraft is operated by Pegasus Airlines, a Turkish low-cost carrier. A quick check of their routes confirms that they operate regular flights to and from London Stansted Airport.

4.  **Ground Services:** A piece of ground equipment in the foreground has the name ""SERVISAIR"" on it. Servisair was a major ground handling company that operated at many UK airports, including Stansted, before being acquired by Swissport in 2015. This helps to both place and date the photo. Another set of stairs has the logo for ""iasport"" (International Aviation Services), another handler that operated in the UK.

5.  **Airport Architecture:** The terminal building in the background, with its long, relatively low-profile design and distinctive roof support structure, is characteristic of the main terminal at London Stansted Airport, designed by Foster + Partners.

Combining these clues—the explicit airport code on the ground, the UK-specific vehicle, the airline known to fly there, the ground handling companies, and the matching architecture—conclusively identifies the location.

London Stansted Airport (STN), England, UK."
